附件:神东煤炭集团公司各级各类人员办公用品配备标准-序号,Unnamed:1-人员类别,Unnamed:2-办公家具类-办公桌,Unnamed:3-办公椅,Unnamed:4-桌前椅,Unnamed:5-沙发,Unnamed:6-茶几,Unnamed:7-背柜,Unnamed:8-文件(书)柜,Unnamed:9-铁皮柜,Unnamed:10-衣柜/床,Unnamed:11-茶水柜,Unnamed:12-衣架,Unnamed:13-报纸架,Unnamed:14-电器类-电视机,Unnamed:15-冰柜,Unnamed:16-台灯,Unnamed:17-饮水机,Unnamed:18-碎纸机,Unnamed:19-办公自动化类-电脑/打印机/传真机/复印机,Unnamed:20-其它类-电话机,Unnamed:21-脸盆与脸盆架(新办公楼除外),Unnamed:22-会议室
1,董事长、党委书记、总经理,2.6～3.0米板台、带侧柜1套,真皮老板椅1把,真皮座椅2把,真皮1套(单人2节、双人1节、四人1节),3个(1大1中1小),1套,四开玻璃门2组,/,休息室配置衣柜1组、双人床1套,1组,/,1组,休息室配置电视机1台,1台,1个,1台,1台,笔记本电脑、台式电脑各1台，打印、传真、复印、扫描一体机1台,2部(其中一部为子母机),/,会议桌椅1套、茶水柜1组、饮水机1台
2,副总经理、副书记、纪委书记、工会主席、三总师,2.4～2.6米板台、带侧柜1套,真皮老板椅1把,真皮座椅2把,真皮1套(单人2节、四人1节),2个(1大1小),1套,四开玻璃门2组,/,休息室配置衣柜1组、双人床1套,1组,/,1组,休息室配置电视机1台,1台,1个,1台,1台,笔记本电脑、台式电脑各1台，打印、传真、复印、扫描一体机1台,2部(其中一部为子母机),/,/
3,总经理助理、副总师,2.0～2.4米板台、带侧柜1套,皮座椅1把,皮座椅2把,皮沙发1套(单人2节、三人1节),2个(1大1小),/,两开玻璃门4组,/,衣柜1组,1组,/,1组,,1台,1个,1台,1台,笔记本电脑、台式电脑各1台，打印、传真、复印、扫描一体机1台,1部(子母机),1套,/
4,公司机关   正处级、副处级、助理级,1.8～2.0米板台、带侧柜1套,皮座椅1把,皮座椅2把,皮沙发1套(单人2节、三人1节),2个(1大1小),/,两开玻璃门3组,/,衣柜1组,1组,/,/,,/,1个,1台,1台,台式电脑或笔记本电脑1台，打印、传真一体机1台,1部,1套,/
5,基层单位   正处级、副处级、助理级,2.0～2.4米板台、带侧柜1套,皮座椅1把,皮座椅2把,皮沙发1套(单人2节、三人1节),2个(1大1小),/,两开玻璃门2组,/,衣柜1组,1组,/,/,,/,1个,1台,1台,台式电脑或笔记本电脑1台，打印、传真一体机1台,1部,1套,/
6,公司机关   其他人员,1.6米板台、带侧柜或卡座座椅1套,普通皮座椅1把/人,/,三人沙发1节/间或单人沙发2节/间,1个/间,/,/,两开玻璃门2组/人,,/,1个/间,/,/,/,/,1台/间,/,台式电脑或笔记本电脑1台/人，打印机1台/人或一个房间共用1台,1部/人,1套/间,/
7,基层单位   科长及机关其他人员,1.6米板台带侧柜或卡座座椅1套,普通座椅1把/人,/,三人沙发1节/间或单人沙发2节/间,1个/间,/,/,两开玻璃门1组/人,,/,1个/间,/,/,/,/,1台/间,/,台式电脑或笔记本电脑1台/人，打印机1台/人或一个房间共用1台,1部/人,1套/间,/
